{
  "$ref": "#/definitions/projects",
  "definitions": {
    "projects": {
      "type": "object",
      "properties": {
        "title": {
          "type": "string"
        },
        "description": {
          "type": "object",
          "properties": {
            "en": {
              "type": "string"
            },
            "fr": {
              "type": "string"
            },
            "zh": {
              "type": "string"
            }
          },
          "required": [
            "en",
            "fr",
            "zh"
          ],
          "additionalProperties": false
        },
        "link": {
          "type": "string",
          "format": "uri"
        },
        "pubDate": {
          "anyOf": [
            {
              "type": "string",
              "format": "date-time"
            },
            {
              "type": "string",
              "format": "date"
            },
            {
              "type": "integer",
              "format": "unix-time"
            }
          ]
        },
        "status": {
          "type": "string",
          "enum": [
            "en_cours",
            "valable"
          ],
          "default": "en_cours"
        },
        "$schema": {
          "type": "string"
        }
      },
      "required": [
        "title",
        "description",
        "link",
        "pubDate"
      ],
      "additionalProperties": false
    }
  },
  "$schema": "http://json-schema.org/draft-07/schema#"
}